{
  "schema_version": "1.0.0",
  "report_id": "e1a-small-variant-report",
  "section_id": "identity-and-provenance",
  "title": "Identity and provenance",
  "order": 1,
  "required": true,
  "required_semantic_inputs": [
    "canonical_interpretation.identity",
    "canonical_interpretation.provenance"
  ],
  "empty_state_policy": "EXPLICIT_NOT_AVAILABLE"
}
